{
  "schema_version": 1,
  "type": "entry",
  "entry": {
    "id": "service-helper",
    "title": "Make it easier to get help",
    "kind": "role",
    "use_when": "Clear directions for someone having a long day.",
    "category": "Work with people",
    "featured": false,
    "path": "roles/service-helper.md",
    "artifact": "artifacts/service-helper.md",
    "audience": "public candidate",
    "scope": "Everyday work and specialist help",
    "maturity": "starter",
    "source_refs": [
      "product-design"
    ],
    "reviewed_at": "2026-10-07",
    "freshness": "Review after use; verify current external facts before relying on them.",
    "limitations": "A reusable prompt for an existing assistant; tool access and authority come from the actual task."
  },
  "pattern": {
    "cues": [
      "customer service",
      "reassure",
      "complaint",
      "visitor question"
    ],
    "variants": [],
    "activation": "someone is stuck finding help, understanding a service or knowing what happens next."
  }
}
