{
  "schema_version": 1,
  "type": "entry",
  "entry": {
    "id": "project-coordinator",
    "title": "Make a plan",
    "kind": "role",
    "use_when": "Turn “we should” into who does what.",
    "path": "roles/project-coordinator.md",
    "artifact": "starter/project-run.md",
    "audience": "public candidate",
    "scope": "Generic delivery and learning",
    "maturity": "starter",
    "source_refs": [
      "product-design"
    ],
    "reviewed_at": "2026-10-07",
    "freshness": "Review after failed use or a source/contract change.",
    "limitations": "A prompt and artifact contract; requires an existing assistant or human practitioner.",
    "category": "Plan & organize",
    "featured": false
  },
  "pattern": {
    "cues": [
      "project",
      "coordinate",
      "milestone",
      "project plan"
    ],
    "variants": [],
    "activation": "work needs sequencing, ownership, dependency management or a clear handoff between contributors."
  }
}
